### ISSUE TITLE
Frequent RequestTimeout errors

### ISSUE THREAD

**Issue by miracle2k** [mopemope/meinheld#41]
Looking at tcpdump:

```
23:35:22.157828 IP localhost.58568 > localhost.irdmi: Flags [P.], seq 3091023342:3091023579, ack 2928175264, win 9186, options [nop,nop,TS val 741129904 ecr 741129904], length 237
E..!_.@.@..............@.=E...h...#........
,,..,,..POST /receipt HTTP/1.1
Host: localhost:8000
Accept-Encoding: gzip, deflate, compress
Content-Length: 3
Content-Type: application/x-www-form-urlencoded
User-Agent: python-requests/2.1.0 CPython/3.3.3 Darwin/13.1.0
Accept: */*

sdf
23:35:22.158618 IP localhost.irdmi > localhost.58568: Flags [P.], seq 1:202, ack 237, win 9171, options [nop,nop,TS val 741129905 ecr 741129904], length 201
E....&@.@............@....h..=F...#........
,,..,,..HTTP/1.1 200 OK
Server: meinheld/0.5.6
Date: Tue, 27 May 2014 21:35:22 GMT
Content-Type: text/plain
Content-Length: 7
Strict-Transport-Security: max-age=31536000
Connection: Keep-Alive

INVALID
23:35:24.159993 IP localhost.irdmi > localhost.58568: Flags [P.], seq 202:375, ack 237, win 9171, options [nop,nop,TS val 741131902 ecr 741129905], length 173
E....K@.@............@....ii.=F...#........
,,.~,,..HTTP/1.0 408 Request Timeout
Content-Type: text/html
Server: meinheld/0.5.6

<html><head><title>Request Timeout</title></head><body><p>Request Timeout.</p></body></html>
```

My interpretation/guess is that a second, unsolicited response comes in over the Keep-Alive connection after the proper one, and both Firefox and Chrome decide to display the second response when I refresh.
